,日期,指数代码,指数名称,指数英文名称,成分券代码,成分券名称,成分券英文名称,交易所,交易所英文名称,权重
0,2023-06-30,000300,沪深300,CSI 300,300014,亿纬锂能,Eve Energy Co Ltd,深圳证券交易所,Shenzhen Stock Exchange,0.393
1,2023-06-30,000300,沪深300,CSI 300,300015,爱尔眼科,Aier Eye Hospital Group Co Ltd,深圳证券交易所,Shenzhen Stock Exchange,0.458
2,2023-06-30,000300,沪深300,CSI 300,600150,中国船舶,China CSSC Holdings Limited,上海证券交易所,Shanghai Stock Exchange,0.389
3,2023-06-30,000300,沪深300,CSI 300,600188,兖矿能源,Yankuang Energy Group Company Limited,上海证券交易所,Shanghai Stock Exchange,0.145
4,2023-06-30,000300,沪深300,CSI 300,600039,四川路桥,Sichuan Road&Bridge Co Ltd,上海证券交易所,Shanghai Stock Exchange,0.136
5,2023-06-30,000300,沪深300,CSI 300,600900,长江电力,China Yangtze Power Co Ltd,上海证券交易所,Shanghai Stock Exchange,1.143
6,2023-06-30,000300,沪深300,CSI 300,600332,白云山,GUANGZHOU BAIYUNSHAN PHARMACEUTICAL HOLDINGS COMPANY LIMITED,上海证券交易所,Shanghai Stock Exchange,0.119
7,2023-06-30,000300,沪深300,CSI 300,600010,包钢股份,Inner Mongolia Baotou Steel Union Co Ltd,上海证券交易所,Shanghai Stock Exchange,0.215
8,2023-06-30,000300,沪深300,CSI 300,600176,中国巨石,"CHINA JUSHI CO., LTD.",上海证券交易所,Shanghai Stock Exchange,0.18
9,2023-06-30,000300,沪深300,CSI 300,600600,青岛啤酒,Tsingtao Brewery Co Ltd,上海证券交易所,Shanghai Stock Exchange,0.194
10,2023-06-30,000300,沪深300,CSI 300,600690,海尔智家,"Haier Smart Home Co., Ltd.",上海证券交易所,Shanghai Stock Exchange,0.47
11,2023-06-30,000300,沪深300,CSI 300,600028,中国石化,China Petroleum & Chemical Corporation,上海证券交易所,Shanghai Stock Exchange,0.64
12,2023-06-30,000300,沪深300,CSI 300,600346,恒力石化,"Hengli Petrochemical Co.,Ltd.",上海证券交易所,Shanghai Stock Exchange,0.16
13,2023-06-30,000300,沪深300,CSI 300,002120,韵达股份,"YUNDA Holding CO., Ltd.",深圳证券交易所,Shenzhen Stock Exchange,0.073
14,2023-06-30,000300,沪深300,CSI 300,601390,中国中铁,China Railway Group Limited,上海证券交易所,Shanghai Stock Exchange,0.412
15,2023-06-30,000300,沪深300,CSI 300,601618,中国中冶,Metallurgical Corporation of China Co Ltd,上海证券交易所,Shanghai Stock Exchange,0.15
16,2023-06-30,000300,沪深300,CSI 300,600219,南山铝业,"Shandong Nanshan Aluminium Co., Ltd.",上海证券交易所,Shanghai Stock Exchange,0.112
17,2023-06-30,000300,沪深300,CSI 300,600837,海通证券,Haitong Securities Company Limited,上海证券交易所,Shanghai Stock Exchange,0.471
18,2023-06-30,000300,沪深300,CSI 300,600132,重庆啤酒,Chongqing Brewery Co Ltd,上海证券交易所,Shanghai Stock Exchange,0.118
19,2023-06-30,000300,沪深300,CSI 300,600115,中国东航,"China Eastern Airlines Co., Ltd.",上海证券交易所,Shanghai Stock Exchange,0.172
20,2023-06-30,000300,沪深300,CSI 300,600104,上汽集团,SAIC Motor Co Ltd,上海证券交易所,Shanghai Stock Exchange,0.35
21,2023-06-30,000300,沪深300,CSI 300,600031,三一重工,Sany Heavy Industry Co Ltd,上海证券交易所,Shanghai Stock Exchange,0.523
22,2023-06-30,000300,沪深300,CSI 300,000977,浪潮信息,"Inspur Electronic Information Industry Co.,Ltd",深圳证券交易所,Shenzhen Stock Exchange,0.264
23,2023-06-30,000300,沪深300,CSI 300,002202,金风科技,Xinjiang Goldwind Science & Technology Co Ltd,深圳证券交易所,Shenzhen Stock Exchange,0.155
24,2023-06-30,000300,沪深300,CSI 300,300059,东方财富,East Money Information Co Ltd,深圳证券交易所,Shenzhen Stock Exchange,0.953
25,2023-06-30,000300,沪深300,CSI 300,601818,光大银行,China Everbright Bank Co Ltd,上海证券交易所,Shanghai Stock Exchange,0.302
26,2023-06-30,000300,沪深300,CSI 300,600406,国电南瑞,"NARI Technology Co., Ltd.",上海证券交易所,Shanghai Stock Exchange,0.491
27,2023-06-30,000300,沪深300,CSI 300,600760,中航沈飞,AVIC SHENYANG AIRCRAFT COMPANY LIMITED,上海证券交易所,Shanghai Stock Exchange,0.262
28,2023-06-30,000300,沪深300,CSI 300,600795,国电电力,GD Power Development Co Ltd,上海证券交易所,Shanghai Stock Exchange,0.181
29,2023-06-30,000300,沪深300,CSI 300,600061,国投资本,"SDIC Capital Co., Ltd",上海证券交易所,Shanghai Stock Exchange,0.097
30,2023-06-30,000300,沪深300,CSI 300,600309,万华化学,"Wanhua Chemical Group Co., Ltd.",上海证券交易所,Shanghai Stock Exchange,0.876
31,2023-06-30,000300,沪深300,CSI 300,600111,北方稀土,"China Northern Rare Earth (Group) High-Tech Co.,Ltd",上海证券交易所,Shanghai Stock Exchange,0.321
32,2023-06-30,000300,沪深300,CSI 300,600809,山西汾酒,Shanxi Xinghuacun Fen Wine Factory Co Ltd,上海证券交易所,Shanghai Stock Exchange,0.478
33,2023-06-30,000300,沪深300,CSI 300,600460,士兰微,Hangzhou Silan Microelectronics Co Ltd,上海证券交易所,Shanghai Stock Exchange,0.136
34,2023-06-30,000300,沪深300,CSI 300,600030,中信证券,CITIC Securities Co Ltd,上海证券交易所,Shanghai Stock Exchange,1.022
35,2023-06-30,000300,沪深300,CSI 300,600803,新奥股份,"ENN Ecological Holdings Co., Ltd.",上海证券交易所,Shanghai Stock Exchange,0.093
36,2023-06-30,000300,沪深300,CSI 300,600362,江西铜业,Jiangxi Copper Co Ltd,上海证券交易所,Shanghai Stock Exchange,0.104
37,2023-06-30,000300,沪深300,CSI 300,600233,圆通速递,"YTO Express Group Co.,Ltd.",上海证券交易所,Shanghai Stock Exchange,0.133
38,2023-06-30,000300,沪深300,CSI 300,600585,海螺水泥,Anhui Conch Cement Co Ltd,上海证券交易所,Shanghai Stock Exchange,0.301
39,2023-06-30,000300,沪深300,CSI 300,600036,招商银行,China Merchants Bank Co Ltd,上海证券交易所,Shanghai Stock Exchange,2.146
40,2023-06-30,000300,沪深300,CSI 300,000768,中航西飞,AVIC XI'AN AIRCRAFT INDUSTRY GROUP COMPANY LTD.,深圳证券交易所,Shenzhen Stock Exchange,0.197
41,2023-06-30,000300,沪深300,CSI 300,000776,广发证券,"GF Securities Co., Ltd.",深圳证券交易所,Shenzhen Stock Exchange,0.23
42,2023-06-30,000300,沪深300,CSI 300,000792,盐湖股份,Qinghai Salt Lake Industry Co Ltd,深圳证券交易所,Shenzhen Stock Exchange,0.551
43,2023-06-30,000300,沪深300,CSI 300,600519,贵州茅台,Kweichow Moutai Co Ltd,上海证券交易所,Shanghai Stock Exchange,5.621
44,2023-06-30,000300,沪深300,CSI 300,600875,东方电气,Dongfang Electric Corporation Limited,上海证券交易所,Shanghai Stock Exchange,0.11
45,2023-06-30,000300,沪深300,CSI 300,600089,特变电工,TBEA Co Ltd,上海证券交易所,Shanghai Stock Exchange,0.459
46,2023-06-30,000300,沪深300,CSI 300,600884,杉杉股份,Ningbo Shanshan Co Ltd,上海证券交易所,Shanghai Stock Exchange,0.091
47,2023-06-30,000300,沪深300,CSI 300,600887,伊利股份,Inner Mongolia Yili Industrial Group Co Ltd,上海证券交易所,Shanghai Stock Exchange,0.954
48,2023-06-30,000300,沪深300,CSI 300,600893,航发动力,AVIC AVIATION ENGINE CORPORATION PLC.,上海证券交易所,Shanghai Stock Exchange,0.298
49,2023-06-30,000300,沪深300,CSI 300,600050,中国联通,China United Network Communications Co Ltd,上海证券交易所,Shanghai Stock Exchange,0.485
50,2023-06-30,000300,沪深300,CSI 300,600085,同仁堂,Beijing Tongrentang Co Ltd,上海证券交易所,Shanghai Stock Exchange,0.209
51,2023-06-30,000300,沪深300,CSI 300,300142,沃森生物,Walvax Biotechnology Co Ltd,深圳证券交易所,Shenzhen Stock Exchange,0.225
52,2023-06-30,000300,沪深300,CSI 300,000651,格力电器,"Gree Electric Appliances,Inc. of Zhuhai",深圳证券交易所,Shenzhen Stock Exchange,0.87
53,2023-06-30,000300,沪深300,CSI 300,000661,长春高新,Chang Chun High and New Technology Industry (Group) Inc.,深圳证券交易所,Shenzhen Stock Exchange,0.233
54,2023-06-30,000300,沪深300,CSI 300,000708,中信特钢,"CITIC Pacific Special Steel Group Co., Ltd",深圳证券交易所,Shenzhen Stock Exchange,0.085
55,2023-06-30,000300,沪深300,CSI 300,000733,振华科技,China Zhenhua (Group) Science & Technology Co Ltd,深圳证券交易所,Shenzhen Stock Exchange,0.185
56,2023-06-30,000300,沪深300,CSI 300,000858,五 粮 液,Wuliangye Yibin Co Ltd,深圳证券交易所,Shenzhen Stock Exchange,1.68
57,2023-06-30,000300,沪深300,CSI 300,002027,分众传媒,"Focus Media Information Technology Co., Ltd.",深圳证券交易所,Shenzhen Stock Exchange,0.364
58,2023-06-30,000300,沪深300,CSI 300,002050,三花智控,"ZHEJIANG SANHUA INTELLIGENT CONTROLS CO.,LTD.",深圳证券交易所,Shenzhen Stock Exchange,0.345
59,2023-06-30,000300,沪深300,CSI 300,600048,保利发展,"Poly Developments and Holdings Group Co., Ltd.",上海证券交易所,Shanghai Stock Exchange,0.495
60,2023-06-30,000300,沪深300,CSI 300,601398,工商银行,Industrial and Commercial Bank of China Ltd,上海证券交易所,Shanghai Stock Exchange,0.894
61,2023-06-30,000300,沪深300,CSI 300,002236,大华股份,Zhejiang Dahua Technology Co Ltd,深圳证券交易所,Shenzhen Stock Exchange,0.174
62,2023-06-30,000300,沪深300,CSI 300,601111,中国国航,Air China Ltd,上海证券交易所,Shanghai Stock Exchange,0.152
63,2023-06-30,000300,沪深300,CSI 300,002064,华峰化学,"Huafon Chemical Co., Ltd.",深圳证券交易所,Shenzhen Stock Exchange,0.072
64,2023-06-30,000300,沪深300,CSI 300,002271,东方雨虹,Beijing Oriental Yuhong Waterproof Technology Co Ltd,深圳证券交易所,Shenzhen Stock Exchange,0.291
65,2023-06-30,000300,沪深300,CSI 300,002475,立讯精密,"Luxshare Precision Industry Co., Ltd.",深圳证券交易所,Shenzhen Stock Exchange,0.857
66,2023-06-30,000300,沪深300,CSI 300,000876,新 希 望,"NEW HOPE LIUHE CO., LTD",深圳证券交易所,Shenzhen Stock Exchange,0.14
67,2023-06-30,000300,沪深300,CSI 300,601088,中国神华,China Shenhua Energy Co Ltd,上海证券交易所,Shanghai Stock Exchange,0.537
68,2023-06-30,000300,沪深300,CSI 300,601766,中国中车,CRRC Corporation Limited,上海证券交易所,Shanghai Stock Exchange,0.418
69,2023-06-30,000300,沪深300,CSI 300,601668,中国建筑,China State Construction Engineering Co Ltd,上海证券交易所,Shanghai Stock Exchange,0.637
70,2023-06-30,000300,沪深300,CSI 300,002304,洋河股份,Jiangsu Yanghe Brewery Joint-Stock Co Ltd,深圳证券交易所,Shenzhen Stock Exchange,0.419
71,2023-06-30,000300,沪深300,CSI 300,601688,华泰证券,Huatai Securities Co Ltd,上海证券交易所,Shanghai Stock Exchange,0.375
72,2023-06-30,000300,沪深300,CSI 300,601628,中国人寿,China Life Insurance Company Limited,上海证券交易所,Shanghai Stock Exchange,0.308
73,2023-06-30,000300,沪深300,CSI 300,000100,TCL科技,TCL Technology Group Corporation,深圳证券交易所,Shenzhen Stock Exchange,0.313
74,2023-06-30,000300,沪深300,CSI 300,600438,通威股份,Tongwei Co Ltd,上海证券交易所,Shanghai Stock Exchange,0.49
75,2023-06-30,000300,沪深300,CSI 300,601988,中国银行,Bank of China Ltd,上海证券交易所,Shanghai Stock Exchange,0.436
76,2023-06-30,000300,沪深300,CSI 300,601808,中海油服,China Oilfield Services Limited,上海证券交易所,Shanghai Stock Exchange,0.043
77,2023-06-30,000300,沪深300,CSI 300,601288,农业银行,Agricultural Bank of China Co Ltd,上海证券交易所,Shanghai Stock Exchange,0.596
78,2023-06-30,000300,沪深300,CSI 300,000786,北新建材,Beijing New Building Materials Public Ltd Co,深圳证券交易所,Shenzhen Stock Exchange,0.131
79,2023-06-30,000300,沪深300,CSI 300,000723,美锦能源,"Shanxi Meijin Energy Co.,Ltd.",深圳证券交易所,Shenzhen Stock Exchange,0.104
80,2023-06-30,000300,沪深300,CSI 300,600745,闻泰科技,"Wingtech Technology Co.,Ltd.",上海证券交易所,Shanghai Stock Exchange,0.225
81,2023-06-30,000300,沪深300,CSI 300,002007,华兰生物,Hualan Biological Engineering INC,深圳证券交易所,Shenzhen Stock Exchange,0.13
82,2023-06-30,000300,沪深300,CSI 300,002001,新和成,Zhejiang NHU Co Ltd,深圳证券交易所,Shenzhen Stock Exchange,0.151
83,2023-06-30,000300,沪深300,CSI 300,002049,紫光国微,"Unigroup Guoxin Microelectronics Co., Ltd.",深圳证券交易所,Shenzhen Stock Exchange,0.335
84,2023-06-30,000300,沪深300,CSI 300,601898,中煤能源,China Coal Energy Co Ltd,上海证券交易所,Shanghai Stock Exchange,0.082
85,2023-06-30,000300,沪深300,CSI 300,601117,中国化学,China National Chemical Engineering Co Ltd,上海证券交易所,Shanghai Stock Exchange,0.161
86,2023-06-30,000300,沪深300,CSI 300,601607,上海医药,"Shanghai Pharmaceuticals Holding Co.,Ltd",上海证券交易所,Shanghai Stock Exchange,0.132
87,2023-06-30,000300,沪深300,CSI 300,601919,中远海控,"COSCO SHIPPING Holdings Co., Ltd.",上海证券交易所,Shanghai Stock Exchange,0.317
88,2023-06-30,000300,沪深300,CSI 300,300122,智飞生物,Chongqing Zhifei Biological Products Co Ltd,深圳证券交易所,Shenzhen Stock Exchange,0.281
89,2023-06-30,000300,沪深300,CSI 300,300124,汇川技术,Shenzhen Inovance Technology Co Ltd,深圳证券交易所,Shenzhen Stock Exchange,0.633
90,2023-06-30,000300,沪深300,CSI 300,600018,上港集团,Shanghai International Port (Group) Co Ltd,上海证券交易所,Shanghai Stock Exchange,0.078
91,2023-06-30,000300,沪深300,CSI 300,600183,生益科技,"Shengyi Technology Co.,Ltd.",上海证券交易所,Shanghai Stock Exchange,0.088
92,2023-06-30,000300,沪深300,CSI 300,600763,通策医疗,TOPCHOICE MEDICAL CORPORATION,上海证券交易所,Shanghai Stock Exchange,0.115
93,2023-06-30,000300,沪深300,CSI 300,600383,金地集团,Gemdale Corporation,上海证券交易所,Shanghai Stock Exchange,0.121
94,2023-06-30,000300,沪深300,CSI 300,600588,用友网络,"Yonyou Network Technology Co., Ltd.",上海证券交易所,Shanghai Stock Exchange,0.223
95,2023-06-30,000300,沪深300,CSI 300,600019,宝钢股份,Baoshan Iron &Steel Co Ltd,上海证券交易所,Shanghai Stock Exchange,0.265
96,2023-06-30,000300,沪深300,CSI 300,600016,民生银行,China Minsheng Banking Corp Ltd,上海证券交易所,Shanghai Stock Exchange,0.493
97,2023-06-30,000300,沪深300,CSI 300,600009,上海机场,Shanghai International Airport Co Ltd,上海证券交易所,Shanghai Stock Exchange,0.299
98,2023-06-30,000300,沪深300,CSI 300,600011,华能国际,Huaneng Power International Inc,上海证券交易所,Shanghai Stock Exchange,0.216
99,2023-06-30,000300,沪深300,CSI 300,600674,川投能源,Sichuan Chuantou Energy Co Ltd,上海证券交易所,Shanghai Stock Exchange,0.178
100,2023-06-30,000300,沪深300,CSI 300,002459,晶澳科技,"JA Solar Technology Co., Ltd.",深圳证券交易所,Shenzhen Stock Exchange,0.364
101,2023-06-30,000300,沪深300,CSI 300,002460,赣锋锂业,Ganfeng Lithium Co Ltd,深圳证券交易所,Shenzhen Stock Exchange,0.364
102,2023-06-30,000300,沪深300,CSI 300,000338,潍柴动力,Wei Chai Power Co Ltd,深圳证券交易所,Shenzhen Stock Exchange,0.358
103,2023-06-30,000300,沪深300,CSI 300,601998,中信银行,China Citic Bank Corporation Limited,上海证券交易所,Shanghai Stock Exchange,0.097
104,2023-06-30,000300,沪深300,CSI 300,601600,中国铝业,Aluminum Corporation of China Limited,上海证券交易所,Shanghai Stock Exchange,0.23
105,2023-06-30,000300,沪深300,CSI 300,600196,复星医药,Shanghai Fosun Pharmaceutical (Group) Co Ltd,上海证券交易所,Shanghai Stock Exchange,0.208
106,2023-06-30,000300,沪深300,CSI 300,600276,恒瑞医药,Jiangsu Hengrui Medicine Co Ltd,上海证券交易所,Shanghai Stock Exchange,1.132
107,2023-06-30,000300,沪深300,CSI 300,600000,浦发银行,Shanghai Pudong Development Bank Co Ltd,上海证券交易所,Shanghai Stock Exchange,0.45
108,2023-06-30,000300,沪深300,CSI 300,600426,华鲁恒升,Shandong Hualu-Hengsheng Chemical Co Ltd,上海证券交易所,Shanghai Stock Exchange,0.241
109,2023-06-30,000300,沪深300,CSI 300,601899,紫金矿业,Zijin Mining Group Co Ltd,上海证券交易所,Shanghai Stock Exchange,0.991
110,2023-06-30,000300,沪深300,CSI 300,002493,荣盛石化,Rongsheng Petro Chemical Co Ltd,深圳证券交易所,Shenzhen Stock Exchange,0.187
111,2023-06-30,000300,沪深300,CSI 300,002466,天齐锂业,"Tianqi Lithium Industries, Inc.",深圳证券交易所,Shenzhen Stock Exchange,0.383
112,2023-06-30,000300,沪深300,CSI 300,601888,中国中免,China Tourism Group Duty Free Corporation Limited,上海证券交易所,Shanghai Stock Exchange,0.571
113,2023-06-30,000300,沪深300,CSI 300,002410,广联达,Glodon Software Co Ltd,深圳证券交易所,Shenzhen Stock Exchange,0.229
114,2023-06-30,000300,沪深300,CSI 300,002180,纳思达,Ninestar Corporation,深圳证券交易所,Shenzhen Stock Exchange,0.18
115,2023-06-30,000300,沪深300,CSI 300,601877,正泰电器,Zhejiang Chint Electrics Co Ltd,上海证券交易所,Shanghai Stock Exchange,0.157
116,2023-06-30,000300,沪深300,CSI 300,002230,科大讯飞,"Iflytek Co.,Ltd.",深圳证券交易所,Shenzhen Stock Exchange,0.666
117,2023-06-30,000300,沪深300,CSI 300,601872,招商轮船,"China Merchants Energy Shipping Co., Ltd.",上海证券交易所,Shanghai Stock Exchange,0.1
118,2023-06-30,000300,沪深300,CSI 300,601166,兴业银行,Industrial Bank,上海证券交易所,Shanghai Stock Exchange,1.204
119,2023-06-30,000300,沪深300,CSI 300,601601,中国太保,China Pacific Insurance (Group) Co Ltd,上海证券交易所,Shanghai Stock Exchange,0.471
120,2023-06-30,000300,沪深300,CSI 300,600999,招商证券,China Merchants Securities Co Ltd,上海证券交易所,Shanghai Stock Exchange,0.266
121,2023-06-30,000300,沪深300,CSI 300,002414,高德红外,Wuhan Guide Infrared Co Ltd,深圳证券交易所,Shenzhen Stock Exchange,0.07
122,2023-06-30,000300,沪深300,CSI 300,002179,中航光电,"AVIC Jonhon Optronic Technology Co.,Ltd.",深圳证券交易所,Shenzhen Stock Exchange,0.305
123,2023-06-30,000300,沪深300,CSI 300,601788,光大证券,Everbright Securities Co Ltd,上海证券交易所,Shanghai Stock Exchange,0.164
124,2023-06-30,000300,沪深300,CSI 300,002142,宁波银行,Bank of Ningbo Co Ltd,深圳证券交易所,Shenzhen Stock Exchange,0.53
125,2023-06-30,000300,沪深300,CSI 300,601009,南京银行,Bank of Nanjing Co Ltd,上海证券交易所,Shanghai Stock Exchange,0.219
126,2023-06-30,000300,沪深300,CSI 300,002074,国轩高科,"GUOXUAN HIGH-TECH CO.,LTD.",深圳证券交易所,Shenzhen Stock Exchange,0.156
127,2023-06-30,000300,沪深300,CSI 300,600606,绿地控股,Greenland Holdings Corporation Limited,上海证券交易所,Shanghai Stock Exchange,0.061
128,2023-06-30,000300,沪深300,CSI 300,600660,福耀玻璃,"Fuyao Glass Industry Group Co.,Ltd",上海证券交易所,Shanghai Stock Exchange,0.304
129,2023-06-30,000300,沪深300,CSI 300,600732,爱旭股份,"Shanghai Aiko Solar Energy Co., Ltd.",上海证券交易所,Shanghai Stock Exchange,0.178
130,2023-06-30,000300,沪深300,CSI 300,600741,华域汽车,HUAYU Automotive Systems Company Limited,上海证券交易所,Shanghai Stock Exchange,0.154
131,2023-06-30,000300,沪深300,CSI 300,600754,锦江酒店,"Shanghai Jin Jiang International Hotels Co.,Ltd.",上海证券交易所,Shanghai Stock Exchange,0.102
132,2023-06-30,000300,沪深300,CSI 300,600845,宝信软件,Shanghai Baosight Software Co Ltd,上海证券交易所,Shanghai Stock Exchange,0.194
133,2023-06-30,000300,沪深300,CSI 300,600886,国投电力,"SDIC Power Holdings Co.,Ltd.",上海证券交易所,Shanghai Stock Exchange,0.2
134,2023-06-30,000300,沪深300,CSI 300,002352,顺丰控股,"S.F. Holding Co., Ltd.",深圳证券交易所,Shenzhen Stock Exchange,0.584
135,2023-06-30,000300,沪深300,CSI 300,601699,潞安环能,Shanxi Lu'an Environmental Energy Development Co Ltd,上海证券交易所,Shanghai Stock Exchange,0.103
136,2023-06-30,000300,沪深300,CSI 300,002252,上海莱士,Shanghai RAAS Blood Products Co Ltd,深圳证券交易所,Shenzhen Stock Exchange,0.188
137,2023-06-30,000300,沪深300,CSI 300,601989,中国重工,China Shipbuilding Industry Co Ltd,上海证券交易所,Shanghai Stock Exchange,0.291
138,2023-06-30,000300,沪深300,CSI 300,300033,同花顺,"Hithink Royalflush Information Network Co.,Ltd.",深圳证券交易所,Shenzhen Stock Exchange,0.199
139,2023-06-30,000300,沪深300,CSI 300,601857,中国石油,PetroChina Co Ltd,上海证券交易所,Shanghai Stock Exchange,0.448
140,2023-06-30,000300,沪深300,CSI 300,601186,中国铁建,China Railway Construction Co Ltd,上海证券交易所,Shanghai Stock Exchange,0.24
141,2023-06-30,000300,沪深300,CSI 300,601939,建设银行,China Construction Bank,上海证券交易所,Shanghai Stock Exchange,0.222
142,2023-06-30,000300,沪深300,CSI 300,601318,中国平安,Ping An Insurance (Group) Company of China Ltd,上海证券交易所,Shanghai Stock Exchange,2.66
143,2023-06-30,000300,沪深300,CSI 300,002129,TCL中环,"TCL Zhonghuan Renewable Energy Technology Co., Ltd.",深圳证券交易所,Shenzhen Stock Exchange,0.568
144,2023-06-30,000300,沪深300,CSI 300,601006,大秦铁路,Daqin Railway Co Ltd,上海证券交易所,Shanghai Stock Exchange,0.234
145,2023-06-30,000300,沪深300,CSI 300,002415,海康威视,Hangzhou Hikvision Digital Technology Co Ltd,深圳证券交易所,Shenzhen Stock Exchange,0.82
146,2023-06-30,000300,沪深300,CSI 300,601377,兴业证券,Industrial Securities Co Ltd,上海证券交易所,Shanghai Stock Exchange,0.224
147,2023-06-30,000300,沪深300,CSI 300,000800,一汽解放,"FAW Jiefang Group Co., Ltd",深圳证券交易所,Shenzhen Stock Exchange,0.041
148,2023-06-30,000300,沪深300,CSI 300,002371,北方华创,"NAURA Technology Group Co.,Ltd.",深圳证券交易所,Shenzhen Stock Exchange,0.444
149,2023-06-30,000300,沪深300,CSI 300,002241,歌尔股份,GoerTek Inc,深圳证券交易所,Shenzhen Stock Exchange,0.225
150,2023-06-30,000300,沪深300,CSI 300,002311,海大集团,Guangdong Haid Group Co Ltd,深圳证券交易所,Shenzhen Stock Exchange,0.206
151,2023-06-30,000300,沪深300,CSI 300,601328,交通银行,Bank of Communications Co LTD,上海证券交易所,Shanghai Stock Exchange,0.843
152,2023-06-30,000300,沪深300,CSI 300,601169,北京银行,Bank of Beijing Co Ltd,上海证券交易所,Shanghai Stock Exchange,0.363
153,2023-06-30,000300,沪深300,CSI 300,000877,天山股份,Xinjiang Tianshan Cement Co Ltd,深圳证券交易所,Shenzhen Stock Exchange,0.075
154,2023-06-30,000300,沪深300,CSI 300,000895,双汇发展,Henan Shuanghui Investment & Development Co Ltd,深圳证券交易所,Shenzhen Stock Exchange,0.135
155,2023-06-30,000300,沪深300,CSI 300,000938,紫光股份,"Unisplendour Co., Ltd.",深圳证券交易所,Shenzhen Stock Exchange,0.386
156,2023-06-30,000300,沪深300,CSI 300,600547,山东黄金,Shandong Gold-Mining Co Ltd,上海证券交易所,Shanghai Stock Exchange,0.225
157,2023-06-30,000300,沪深300,CSI 300,600015,华夏银行,Hua Xia Bank Co Ltd,上海证券交易所,Shanghai Stock Exchange,0.182
158,2023-06-30,000300,沪深300,CSI 300,600436,片仔癀,Zhangzhou Pientzehuang Pharmaceutical Co Ltd,上海证券交易所,Shanghai Stock Exchange,0.457
159,2023-06-30,000300,沪深300,CSI 300,600029,南方航空,China Southern Airlines Co Ltd,上海证券交易所,Shanghai Stock Exchange,0.172
160,2023-06-30,000300,沪深300,CSI 300,600584,长电科技,"JCET Group Co., Ltd.",上海证券交易所,Shanghai Stock Exchange,0.235
161,2023-06-30,000300,沪深300,CSI 300,601799,星宇股份,Changzhou Xingyu Automotive Lighting Systems Co Ltd,上海证券交易所,Shanghai Stock Exchange,0.093
162,2023-06-30,000300,沪深300,CSI 300,000963,华东医药,Huadong Medicine Co Ltd,深圳证券交易所,Shenzhen Stock Exchange,0.201
163,2023-06-30,000300,沪深300,CSI 300,000983,山西焦煤,"Shanxi Coking Coal Energy Group Co.,Ltd.",深圳证券交易所,Shenzhen Stock Exchange,0.109
164,2023-06-30,000300,沪深300,CSI 300,600570,恒生电子,Hundsun Technologies Inc.,上海证券交易所,Shanghai Stock Exchange,0.356
165,2023-06-30,000300,沪深300,CSI 300,601336,新华保险,New China Life Insurance Co Ltd,上海证券交易所,Shanghai Stock Exchange,0.162
166,2023-06-30,000300,沪深300,CSI 300,000425,徐工机械,XCMG Construction Machinery Co Ltd,深圳证券交易所,Shenzhen Stock Exchange,0.169
167,2023-06-30,000300,沪深300,CSI 300,300207,欣旺达,Sunwoda Electronic Co Ltd,深圳证券交易所,Shenzhen Stock Exchange,0.129
168,2023-06-30,000300,沪深300,CSI 300,002555,三七互娱,"WUHU SANQI INTERACTIVE ENTERTAINMENT NETWORK TECHNOLOGY GROUP CO.,LTD.",深圳证券交易所,Shenzhen Stock Exchange,0.287
169,2023-06-30,000300,沪深300,CSI 300,002594,比亚迪,BYD Co Ltd,深圳证券交易所,Shenzhen Stock Exchange,1.239
170,2023-06-30,000300,沪深300,CSI 300,601901,方正证券,Founder Securities Co Ltd,上海证券交易所,Shanghai Stock Exchange,0.142
171,2023-06-30,000300,沪深300,CSI 300,300223,北京君正,Ingenic Semiconductor Co Ltd,深圳证券交易所,Shenzhen Stock Exchange,0.113
172,2023-06-30,000300,沪深300,CSI 300,002601,龙佰集团,"LB Group Co., Ltd.",深圳证券交易所,Shenzhen Stock Exchange,0.125
173,2023-06-30,000300,沪深300,CSI 300,601216,君正集团,"Inner Mongolia Junzheng Energy & Chemical Group Co.,Ltd.",上海证券交易所,Shanghai Stock Exchange,0.073
174,2023-06-30,000300,沪深300,CSI 300,000596,古井贡酒,Anhui Gujing Distillery Co Ltd,深圳证券交易所,Shenzhen Stock Exchange,0.214
175,2023-06-30,000300,沪深300,CSI 300,000617,中油资本,CNPC Capital Company Limited,深圳证券交易所,Shenzhen Stock Exchange,0.097
176,2023-06-30,000300,沪深300,CSI 300,300316,晶盛机电,"Zhejiang Jingsheng Mechanical & Electrical Co., Ltd.",深圳证券交易所,Shenzhen Stock Exchange,0.246
177,2023-06-30,000300,沪深300,CSI 300,601633,长城汽车,Great Wall Motor Co Ltd,上海证券交易所,Shanghai Stock Exchange,0.164
